sentence,like_count,comment_count,share_count,date,comment,score,ratio,백신,부동산,북한,재난지원금,국민지원금,청년,문재인,윤석열,이준석,이재명,복지,접종,노조,기업
"[기본소득 재원마련방안의 자가당착]
이재명 후보가 임기 내에 청년에게 연 200만원 그 외 전 국민에게 연 100만원을 지급하겠다고 약속했습니다. 연간 약 58조 원의 천문학적 예산이 들어갑니다.
이후보는 예산절감으로 25조원을 마련하고, 조세감면 축소로 25조원을 더 만들겠다는 건데요. 이것도 모자라면 또 추가로 국토보유세와 탄소세를 더 걷겠다는 것이지요.
이래서 국정경험과 경제 내공이 필요한 겁니다. 거대한 나라 살림은 꼼꼼하게 설계하고 충분히 따져야 합니다. 국민 실생활과 미래가 걸려있는 중차대한 일입니다. 한 순간 판단오류로 한 치만 삐끗해도 그 고통은 모두 국민에게 돌아갑니다.
이후보의 호언장담을 따져보기 이전에 이처럼 무모한 주장에 대한 근거가 얼마나 자가당착적인지부터 살펴보겠습니다.
예산절감으로 25조원을 마련할 수 있다면 현재 문재인 정부가 25조원을 허투루 쓰고 있다는 전제가 우선돼야 합니다. 
한두 푼도 아니고 무려 25조원 입니다. 무엇을 어디서 줄이겠다는 것인지 명확하게 말해야 합니다. 그러지 않으면 문재인 정부는 매년 25조원을 낭비하는 정부가 돼버립니다. 
문재인 정부의 복지정책을 깡그리 뒤엎지 않고서는 25조원이나 되는 천문학적 재원을 마련할 수 없습니다.
문재인 정부를 승계하자는 겁니까? 갈아엎자는 겁니까?
조세 감면 축소를 통해 25조원을 추가로 걷겠다고 합니다. 조세감면의 의미를 아시는지요? 
조세감면의 대부분은 서민, 중소기업, 연구개발, 고용과 관련된 항목들입니다. 도대체 문재인 정부가 어디서 25조원이나 불필요하게 세금을 깎아주었다는 겁니까? 
이후보가 주장하는 공정성장은 말로만 해선 안 됩니다. 효율적 정책을 집행하기 위한 연구개발은 물론이며 고용과 서민에 관련된 재정지출뿐만 아니라 조세지출도 늘려야 합니다. 그런데 그 예산을 삭감하겠다고 하니 공정성장 주장은 폐기하시는 겁니까?  
이러니 야당 국회의원에게조차 문재인정부의 정책 실패에 대한 내부고발자라는 비아냥을 듣는 것 아니겠습니까?
이런 무리수를 두면서까지 50조원을 거뒀다 칩시다. 아직 이후보가 주장하는 1년 분 기본소득을 나눠주기에도 부족합니다. 
그럴 때에는 또 세금을 걷겠다는 것이 이재명 후보의 생각입니다. 그 증세의 대상으로 국토보유세와 탄소세를  지목하셨지요.
이쯤에서는 이후보를 탓하기 전에 주변의 정책 참모들을 꾸짖고 싶어집니다. 조세재정의 운용원리를 조금이라도 안다면 차마 입 밖에 꺼낼 수 없는 아마추어적 주장이기 때문입니다.
국토보유세와 탄소세를 만든 취지는 궁극적으로 토지에 대한 지대와 탄소배출량을 줄여 그 세금을 필요없도록 만드는 것입니다
과도한 부동산 가격 상승으로 발생하는 지대에 대해 세금을 걷겠다는 것이 국토보유세입니다. 또 탄소중립 사회를 위해 탄소배출량에 세금을 부담토록 하겠다는 것이 탄소세죠.
두 정책이 다 착실히 안착하면 세수가 발생하지 않아야 하는 것입니다. 그런데 두 재원으로 기본소득을 나눠 주려한다니요? 두 조세정책이 원래 의도했던 정책목표는 실패해야 가능한  합니다. 기본소득 주자고 정책실패를 기다려야 합니까?
이 후보의 재원마련방안은 자기모순에 빠져 있습니다. 
진심으로 말씀드립니다. 이제 족한 줄 알고 그만 합시다. 같은 당 후보로서 다른 당의 조롱꺼리가 되는 모습을 지켜보는 것이 편치 않습니다. 우리당에 도움이 되지 않습니다. 
부디 선거를 위한 정치적 선동이 아닌 국민을 위한 정책으로 경쟁합시다.",516,223,135,2021-07-23 00:00:00,"['기본소득', '재원', '마련', '방안', '의', '자가', '당착', '이재명', '후보', '가', '임기', '내', '에', '청년', '에게', '연', '200만원', '그', '외', '전', '국민', '에게', '연', '100만원', '을', '지급', '하겠다고', '약속', '했습니다', '연간', '약', '58조', '원', '의', '천문학', '적', '예산', '이', '들어갑니다', '이', '후보', '는', '예산', '절감', '으로', '25조원', '을', '마련', '하고', '조세', '감면', '축소', '로', '25조원', '을', '더', '만들겠다는', '건데', '요', '이', '것', '도', '모자라면', '또', '추가', '로', '국토', '보', '유세', '와', '탄소세', '를', '더', '걷겠다는', '것', '이지', '요', '이래서', '국정', '경험', '과', '경제', '내공', '이', '필요한', '겁니다', '거대한', '나라', '살림', '은', '꼼꼼하게', '설계', '하고', '충분히', '따져야', '합니다', '국민', '실생활', '과', '미래', '가', '걸려있는', '중차', '대', '한', '일', '입니다', '한', '순간', '판단', '오류로', '한', '치', '만', '삐끗', '해도', '그', '고통', '은', '모두', '국민', '에게', '돌아갑니다', '이', '후보', '의', '호언', '장담', '을', '따져', '보기', '이전', '에', '이처럼', '무모한', '주장', '에', '대한', '근거', '가', '얼마나', '자가', '당착', '적', '인지', '부터', '살펴보겠습니다', '예산', '절감', '으로', '25조원', '을', '마련', '할', '수', '있다면', '현재', '문재인', '정부', '가', '25조원', '을', '허투루', '쓰고', '있다는', '전제', '가', '우선', '돼야', '합니다', '한두', '푼', '도', '아니고', '무려', '25조원', '입니다', '무엇', '을', '어디서', '줄이겠다는', '것', '인지', '명확하게', '말', '해야', '합니다', '그러지', '않으면', '문재인', '정부', '는', '매년', '25조원', '을', '낭비하는', '정부', '가', '돼', '버립니다', '문재인', '정부', '의', '복지', '정책', '을', '깡그리', '뒤엎', '지', '않고서는', '25조원', '이나', '되는', '천문학', '적', '재원', '을', '마련', '할', '수', '없습니다', '문재인', '정부', '를', '승계', '하자는', '겁', '니까', '갈아엎자는', '겁', '니까', '조세', '감면', '축소', '를', '통해', '25조원', '을', '추가', '로', '걷겠다고', '합니다', '조세', '감면의', '의미', '를', '아시는지요', '조세', '감면의', '대부분', '은', '서민', '중소기업', '연구개발', '고용', '과', '관련', '된', '항목', '들입니다', '도대체', '문재인', '정부', '가', '어디서', '25조원', '이나', '불필요하게', '세금', '을', '깎아주었다는', '겁', '니까', '이후', '보가', '주장', '하는', '공', '정성', '장', '은', '말로', '만', '해선', '안', '됩니다', '효율', '적', '정책', '을', '집행', '하기', '위', '한', '연구개발', '은', '물론', '이며', '고용', '과', '서민', '에', '관련', '된', '재정', '지출', '뿐', '만', '아니라', '조', '세', '지출', '도', '늘려야', '합니다', '그런데', '그', '예산', '을', '삭감', '하겠다고', '하니', '공정', '성장', '주장', '은', '폐기', '하시는', '겁', '니까', '이러니', '야당', '국회의원', '에게', '조차', '문재인', '정부', '의', '정책', '실패', '에', '대한', '내부고발자', '라는', '비아', '냥', '을', '듣는', '것', '아니겠습니까', '이런', '무리수', '를', '두면서까지', '50조원', '을', '거뒀다', '칩시다', '아직', '이후', '보가', '주장', '하는', '1년', '분', '기본소득', '을', '나눠', '주기', '에도', '부족합니다', '그럴', '때', '에는', '또', '세금', '을', '걷겠다는', '것', '이', '이재명', '후보', '의', '생각', '입니다', '그', '증세', '의', '대상', '으로', '국토', '보', '유세', '와', '탄소세', '를', '지목', '하셨지요', '이쯤', '에서는', '이', '후보', '를', '탓', '하기', '전', '에', '주변', '의', '정책', '참모', '들', '을', '꾸짖고', '싶어', '집니다', '조', '세', '재정', '의', '운용', '원리', '를', '조금', '이라도', '안다면', '차마', '입', '밖에', '꺼낼', '수', '없는', '아마추어', '적', '주장', '이기', '때문', '입니다', '국토', '보', '유세', '와', '탄소세', '를', '만든', '취지', '는', '궁극', '적', '으로', '토지', '에', '대한', '지대', '와', '탄소', '배출', '량', '을', '줄여', '그', '세금', '을', '필요없도록', '만드는', '것', '입니다', '과도', '한', '부동산', '가격', '상승', '으로', '발생', '하는', '지대', '에', '대해', '세금', '을', '걷겠다는', '것', '이', '국토', '보', '유세', '입니다', '또', '탄소', '중립', '사회', '를', '위해', '탄소', '배출', '량', '에', '세금', '을', '부담', '토록', '하겠다는', '것', '이', '탄소세', '죠', '두', '정책', '이', '다', '착실히', '안착', '하면', '세수', '가', '발생', '하지', '않아야', '하는', '것', '입니다', '그런데', '두', '재원', '으로', '기본소득', '을', '나눠', '주려한', '다니요', '두', '조', '세', '정책', '이', '원래', '의도', '했던', '정책', '목표', '는', '실패해야', '가능한', '합니다', '기본소득', '주자', '고', '정책', '실패', '를', '기다려야', '합', '니까', '이', '후보', '의', '재원', '마련', '방안', '은', '자기', '모순', '에', '빠져', '있습니다', '진심', '으로', '말씀드립니다', '이제', '족', '한', '줄', '알', '고', '그만', '합시다', '같은', '당', '후보', '로서', '다른', '당', '의', '조롱', '꺼리가', '되는', '모습', '을', '지켜보는', '것', '이', '편치', '않습니다', '우리당', '에', '도움', '이', '되지', '않습니다', '부디', '선거', '를', '위', '한', '정치', '적', '선동', '이', '아닌', '국민', '을', '위', '한', '정책', '으로', '경쟁', '합시다']",-6.14420436493287,-1.62,,True,,,,True,True,,,True,True,,,True
"벌써 3년이 지났습니다.
6411번 버스는 아직도 운행 중입니다.
님께서 남기신 숙제를 
아직도 다 풀지 못하고 있습니다.
보호받아야 할 인간의 인권과 존엄은
격차와 불공정으로 이어지고 있습니다.
‘노동 존중’의 세상’
‘인권이 보호받는 세상’
‘격차와 차별 없이 모든 국민이 행복한 세상’
대한민국이 존재하는 한
함께 가져가야 할 변하지 않는 금언입니다. 
님과 제가 꿈꾸던 세상을 향해 뚜벅뚜벅 걸어가겠습니다.
사진출처-경향신문",441,53,90,2021-07-23 00:00:00,"['벌써', '3년', '이', '지났습니다', '6411', '번', '버스', '는', '아직도', '운행', '중', '입니다', '님', '께서', '남기신', '숙제', '를', '아직도', '다', '풀', '지', '못', '하고', '있습니다', '보호', '받아야', '할', '인간', '의', '인권', '과', '존엄', '은', '격차', '와', '불공정', '으로', '이어지고', '있습니다', '노동', '존중', '의', '세상', '인권', '이', '보호', '받는', '세상', '격차', '와', '차별', '없이', '모든', '국민', '이', '행복한', '세상', '대한민국', '이', '존재', '하는', '한', '함께', '가져가야', '할', '변하지', '않는', '금언', '입니다', '님', '과', '제', '가', '꿈꾸던', '세상', '을', '향', '해', '뚜벅뚜벅', '걸어가겠습니다', '사진', '출처', '경향신문']",1.7855795635067127,0.61,,,,,,,,,,,,,,
"배구 월드스타 김연경선수의 올림픽을 응원합니다!
김연경 선수는 지난 2012년 터키 이적 과정에서의 
불리한 국내규정 때문에 해외이적이 어려웠던 상황이 있었습니다. 
당시 저와 동료의원들이 기자회견까지 열어 
대한배구협회에 국제이적동의서를 발급해달라는 
요청을 했던 기억이 여전히 생생합니다. 
그런 노력의 결과로 김연경 선수는 
이적이 가능하게 되었고 온 국민이 아시는 것처럼 
대한민국의 위상을 세계에 떨치는 맹활약을 펼쳤습니다. 
지금 생각해도 너무 뿌듯한 기억 때문에 
김연경 선수에게 더 많은 관심과 응원을 보내게 됩니다. 
이번 올림픽에서 또 한번 맹활약을 기대하겠습니다. 
메달은 덤입니다. 
김연경 선수와 우리 국가대표선수단의 피・땀・눈물이 보상받는 
값진 대회가 되길 빌겠습니다. 
김연경 파이팅, 대한민국 화이팅!
#정세균 #김연경 #국가대표 #올림픽 #파이팅
#국민이 #강한 #대한민국
국민여러분과 함께 가겠습니다.",216,67,69,2021-07-23 00:00:00,"['배구', '월드', '스타', '김연경', '선수', '의', '올림픽', '을', '응원', '합니다', '김연경', '선수', '는', '지난', '2012년', '터키', '이적', '과정', '에서의', '불리한', '국내', '규정', '때문', '에', '해외', '이적', '이', '어려웠던', '상황', '이', '있었습니다', '당시', '저', '와', '동료', '의원', '들', '이', '기자회견', '까지', '열어', '대', '한', '배구', '협회', '에', '국제', '이적', '동의', '서', '를', '발급', '해달라는', '요청', '을', '했던', '기억', '이', '여전히', '생생합니다', '그런', '노력', '의', '결과', '로', '김연경', '선수', '는', '이적', '이', '가능하게', '되었고', '온', '국민', '이', '아시', '는', '것', '처럼', '대한민국', '의', '위상', '을', '세계', '에', '떨치는', '맹활약', '을', '펼쳤습니다', '지금', '생각', '해도', '너무', '뿌듯한', '기억', '때문', '에', '김연경', '선수', '에게', '더', '많은', '관심', '과', '응원', '을', '보내게', '됩니다', '이번', '올림픽', '에서', '또', '한번', '맹활약', '을', '기대하겠습니다', '메달', '은', '덤', '입니다', '김연경', '선수', '와', '우리', '국가대표', '선수단', '의', '피땀', '눈물', '이', '보상', '받는', '값진', '대회', '가', '되길', '빌겠습니다', '김연경', '파이팅', '대한민국', '화이팅', '정세균', '김연경', '국가대표', '올림픽', '파이팅', '국민', '이', '강한', '대한민국', '국민', '여러', '분과', '함께', '가겠습니다']",-0.21442043649328735,-0.07,,,,,,,,,,,,,,
"[일자리를 찾지 못해 고독사한 청년의 절망에 답해야 합니다.]
비좁은 원룸에 이력서 150장을 남기고 외롭게 세상을 떠난 31세 청년의 사연이 국민의 마음을 아프게 합니다.
일자리를 구하지 못한 채 절망감과 상실감 속에 외롭게 스러져간 청년의 좌절감을 감히 상상하기조차 두렵습니다.
코로나가 불러온 위기는 결코 평등하지 않습니다. 청년을 비롯한 여성, 노인, 비정규직, 자영업자 등 사회적 취약계층에 더 가혹한 고통을 안기고 있습니다.
정세균이 꿈꾸는 강한 대한민국은
청년들이 자유롭게 일하고, 결혼하고,
아이를 낳아 기를 수 있는 사회입니다.
식어버린 청년들의 심장을 다시 뜨겁게 만들어야 합니다. 무너진 사다리를 복원하여 불평등과 격차를 해소하고 땀 흘린 만큼 정당한 대우를 받을 수 있는 사회를 만들겠습니다.
삼가 故人의 안식과 영면을 기원합니다.
사진출처-커뮤니티 사이트",342,38,53,2021-07-22 00:00:00,"['일자리', '를', '찾지', '못', '해', '고독사', '한', '청년', '의', '절망', '에', '답', '해야', '합니다', '비', '좁은', '원룸', '에', '이력서', '150', '장', '을', '남기고', '외롭게', '세상', '을', '떠난', '31', '세', '청년', '의', '사연', '이', '국민', '의', '마음', '을', '아프게', '합니다', '일자리', '를', '구', '하지', '못', '한', '채', '절망', '감', '과', '상실', '감', '속', '에', '외롭게', '스러져', '간', '청년', '의', '좌절', '감', '을', '감히', '상상', '하기조차', '두렵습니다', '코로나', '가', '불러', '온', '위기', '는', '결코', '평등하지', '않습니다', '청년', '을', '비롯', '한', '여성', '노인', '비정규직', '자영', '업자', '등', '사회', '적', '취약', '계층', '에', '더', '가혹한', '고통', '을', '안기고', '있습니다', '정세균', '이', '꿈꾸는', '강한', '대한민국', '은', '청년', '들', '이', '자유롭게', '일', '하고', '결혼', '하고', '아이', '를', '낳아', '기를', '수', '있는', '사회', '입니다', '식어', '버린', '청년', '들', '의', '심장', '을', '다시', '뜨겁게', '만들어야', '합니다', '무너진', '사다리', '를', '복원', '하여', '불평등', '과', '격차', '를', '해소', '하고', '땀', '흘린', '만큼', '정당한', '대우', '를', '받을', '수', '있는', '사회', '를', '만들겠습니다', '삼가', '의', '안식', '과', '영', '면', '을', '기원', '합니다', '사진', '출처', '커뮤니티', '사이트']",-11.0,-3.42,,,,,,True,,,,,,,,
"[전남 특별재난지역 선포를 환영합니다.]
기록적인 폭우로 심각한 피해를 입은 전남 남부에 대한 특별재난지역 선포가 이뤄졌습니다. 며칠 전 진도·해남·강진·장흥군 등 4개 지역을 특별재난지역으로 지정해달라는 건의를 드린 바 있습니다. 신속하게 후속 조치를 취해주신 정부 당국의 노력에 감사드립니다.
정부와 지자체 간 긴밀한 협력 속에서 신속한 지원과 피해 복구가 이루어지길 기대합니다. 아울러 차제에 자연재해 피해 산정 시 농축수산물 피해도 포함되도록 관련 규정이 개선되길 바랍니다. 생활의 터전을 잃어버린 전남지역 수해민들께 다시 한번 위로의 말씀을 드립니다.
아울러 폭우 피해에 이어 폭염 피해도 우려됩니다. 관계기관은 폭염 피해를 최소화하기 위한 지원에도 만전을 기해주시기 바랍니다.",281,50,102,2021-07-22 00:00:00,"['전남', '특별', '재난', '지역', '선포', '를', '환영', '합니다', '기록', '적', '인', '폭우', '로', '심각한', '피해', '를', '입은', '전남', '남부', '에', '대한', '특별', '재난', '지역', '선포', '가', '이뤄졌습니다', '며칠', '전', '진도', '해남', '강진', '장흥군', '등', '4', '개', '지역', '을', '특별', '재난', '지역', '으로', '지정', '해달라는', '건의', '를', '드린', '바', '있습니다', '신속하게', '후속', '조치', '를', '취', '해주신', '정부', '당국', '의', '노력', '에', '감사', '드립니다', '정부', '와', '지자체', '간', '긴밀한', '협력', '속', '에서', '신속한', '지원', '과', '피해', '복구', '가', '이루어지길', '기대합니다', '아울러', '차제', '에', '자연재해', '피해', '산정', '시', '농축', '수산물', '피해', '도', '포함', '되도록', '관련', '규정', '이', '개선', '되길', '바랍니다', '생활', '의', '터전', '을', '잃어버린', '전남', '지역', '수해', '민', '들', '께', '다시', '한번', '위로', '의', '말씀', '을', '드립니다', '아울러', '폭우', '피해', '에', '이어', '폭염', '피해', '도', '우려', '됩니다', '관계', '기관', '은', '폭염', '피해', '를', '최소', '화하기', '위', '한', '지원', '에도', '만전', '을', '기', '해주시기', '바랍니다']",-1.1072102182466437,-0.35,,,,,,,,,,,,,,
"앞뒤 안 맞는 기본소득 발표, 이재명 후보의 최근 도덕성 논란을 덮어보려는 방패막이는 아니겠지요?
이재명 후보의 기본소득에 나라를 망하게 하는 정책이라고 거듭 지적해왔습니다. 지난 토론회에서 공약도 아니고 1순위 정책도 아니라더니 이제 와서 “시장경제를 살리는 가장 유효한 핵심정책” 으로 “반드시 시행하겠다.”니요?
도대체 '반드시 시행할 핵심정책'과 '공약'이 어떻게 다른 겁니까? 
국가경영에 대한 약속을 이리저리 돌려 국민을 속이려 들어 선 안 됩니다. 
명백한 국민기만입니다. 토지세든, 탄소세든, 기본적인 목적세든 세금으로 기본소득을 주자는 주장인데 우리 앞에 저출생고령화, 기후변화 등 해결해야할 과제가 산처럼 쌓여있습니다. 
이 후보가 주장하는 기본소득은 사회적 취약계층을 위해 쓰여야할 국가 예산을 빼앗아 부자들에게 나눠주자는 발상과 똑 같습니다. 
조세의 정의에도 부합하지 않고 사회적 양극화를 심화시킬 뿐만 아니라, 소비 진작과 경세활성화에는 아무런 도움도 되지 않는 불공정, 불공평, 불필요한 3不의 정책입니다. 
부디, 수권정당의 후보로서 국민선동 경쟁이 아닌 실현가능하고 국민에 도움이 되는 정책으로 경쟁합시다.",420,203,124,2021-07-22 00:00:00,"['앞뒤', '안', '맞는', '기본소득', '발표', '이재명', '후보', '의', '최근', '도덕성', '논란', '을', '덮어', '보려는', '방패', '막이는', '아니겠지요', '이재명', '후보', '의', '기본소득', '에', '나라', '를', '망하게', '하는', '정책', '이라고', '거듭', '지적', '해왔습니다', '지난', '토론회', '에서', '공약', '도', '아니고', '1', '순위', '정책', '도', '아니라', '더니', '이제', '와서', '시장경제', '를', '살리는', '가장', '유효한', '핵심', '정책', '으로', '반드시', '시행', '하겠다니요', '도대체', '반드시', '시행', '할', '핵심', '정책', '과', '공약', '이', '어떻게', '다른', '겁', '니까', '국가', '경영', '에', '대한', '약속', '을', '이리저리', '돌려', '국민', '을', '속이려', '들어', '선', '안', '됩니다', '명백한', '국민', '기만', '입니다', '토지', '세든', '탄소세', '든', '기본', '적', '인', '목적', '세든', '세금', '으로', '기본소득', '을', '주자', '는', '주장', '인데', '우리', '앞', '에', '저', '출생', '고령화', '기후변화', '등', '해결', '해야', '할', '과제', '가', '산', '처럼', '쌓여있습니다', '이', '후보', '가', '주장', '하는', '기본소득', '은', '사회', '적', '취약', '계층', '을', '위해', '쓰여', '야할', '국가', '예산', '을', '빼앗아', '부자', '들', '에게', '나눠주자는', '발상', '과', '똑', '같습니다', '조세', '의', '정의', '에도', '부합', '하지', '않고', '사회', '적', '양극화', '를', '심화', '시킬', '뿐', '만', '아니라', '소비', '진작', '과', '경', '세', '활성화', '에는', '아무런', '도움', '도', '되지', '않는', '불공정', '불공평', '불필요한', '3', '의', '정책', '입니다', '부디', '수권', '정당', '의', '후보', '로서', '국민', '선동', '경쟁', '이', '아닌', '실현', '가능하고', '국민', '에', '도움', '이', '되는', '정책', '으로', '경쟁', '합시다']",-1.4288408729865743,-0.43,,,,,,,,,,True,,,,
