sentence,like_count,comment_count,share_count,date,comment,score,ratio,백신,부동산,북한,재난지원금,국민지원금,청년,문재인,윤석열,이준석,이재명,복지,접종,노조,기업
"최재형 후보의 조부와 증조부의 친일 행위가 논란이 되자 문재인 대통령의 부친을 끌어와 물타기를 하더니, 이번엔 대통령 자녀를 물고 늘어지고 있습니다.
최재형 후보, 정치 신인이면 신인답게 정책과 비전으로 승부 해야 합니다. 잘못한 일은 국민께 진솔한 사과가 우선입니다.
정치는 시작도 끝도 책임입니다. 책임을 회피하고 거짓을 선동하면 결코 국민께 신뢰 받을 수 없습니다.
최재형 후보가 요즘 보여주고 있는 정치는 기존 수구 정치와 똑같습니다. 핑계대고, 자신의 허물을 전가하는 구태의연한 정치를 답습하려고 배신자 소리까지 들으며 정치인이 됐습니까? 
그런 정치인은 지금도 차고 넘칩니다.
자신의 과오를 덮으려 연일 ‘文정부 때리기’ 모습만 보여주는 최재형식 정치에 참으로 실망했습니다.
평생 판사로 살아왔다는 사실을 자랑으로 여기며 선관위원장, 감사원장까지 지내신 분이 지난 번엔 공직선거법을 위반하더니, 이번 이자소득세 탈루 의혹에 대해서는 ‘가족들이 세법에 대해 잘 몰랐다’고 변명하시는 모습이 참 옹색합니다.
이제라도 알았으면 최재형 후보의 공언대로 이자소득세를 납부하면 됩니다. 그리고 다시는 그러지 마십시오.
그리고 더 이상 자신의 관련 의혹을 물타기할 요량으로 대통령을 끌어들이지 마십시오. 
우리 국민은 최재형 후보의 거짓말에 속지 않습니다. 
국민을 믿어야지 섣부른 정치 술수를 믿어서야 어찌 새로운 정치를 하겠습니까.",466,46,149,2021-08-17 00:00:00,"['최재형', '후보', '의', '조부', '와', '증조부', '의', '친일', '행위', '가', '논란', '이', '되자', '문재인', '대통령', '의', '부친', '을', '끌어와', '물', '타기를', '하더니', '이번', '엔', '대통령', '자녀', '를', '물', '고', '늘어지고', '있습니다', '최재형', '후보', '정치', '신인', '이면', '신인답게', '정책', '과', '비전으로', '승부', '해야', '합니다', '잘못', '한', '일', '은', '국민', '께', '진솔한', '사과', '가', '우선', '입니다', '정치', '는', '시작', '도', '끝', '도', '책임', '입니다', '책임', '을', '회피', '하고', '거짓', '을', '선동', '하면', '결코', '국민', '께', '신뢰', '받을', '수', '없습니다', '최재형', '후보', '가', '요즘', '보여주고', '있는', '정치', '는', '기존', '수구', '정치', '와', '똑같습니다', '핑계', '대고', '자신', '의', '허물', '을', '전가', '하는', '구태의연한', '정치', '를', '답습', '하려고', '배신자', '소리', '까지', '들으며', '정치인', '이', '됐습니까', '그런', '정치인', '은', '지금', '도', '차고', '넘칩니다', '자신', '의', '과오', '를', '덮으려', '연일', '정부', '때리기', '모습', '만', '보여주는', '최재형', '식', '정치', '에', '참으로', '실망했습니다', '평생', '판사', '로', '살아왔다는', '사실', '을', '자랑', '으로', '여기', '며', '선관위', '원장', '감사원장', '까지', '지내신', '분', '이', '지난', '번', '엔', '공직선거법', '을', '위반', '하더니', '이번', '이자', '소득세', '탈루', '의혹', '에', '대해', '서는', '가족', '들', '이', '세법', '에', '대해', '잘', '몰랐다고', '변명', '하시는', '모습', '이', '참', '옹색', '합니다', '이제', '라도', '알았으면', '최재형', '후보', '의', '공언', '대로', '이자', '소득세', '를', '납부', '하면', '됩니다', '그리고', '다시는', '그러지', '마십시오', '그리고', '더', '이상', '자신', '의', '관련', '의혹', '을', '물', '타기', '할', '요량', '으로', '대통령', '을', '끌어', '들이지', '마십시오', '우리', '국민', '은', '최재형', '후보', '의', '거짓말', '에', '속지', '않습니다', '국민', '을', '믿어야지', '섣부른', '정치', '술수', '를', '믿어', '서야', '어찌', '새로운', '정치', '를', '하겠습니까']",-6.345723868670343,-1.88,,,,,,,True,,,,,,,
"[일본 정부는 독도 침략 야욕을 포기하라]
일본 정부가 자국 어린이와 청소년을 대상으로 발간한 방위백서에 독도를 자국 영토로 표기하고 독도 영유권을 주장한 사실이 확인됐습니다.
일본 정부는 미래세대에 독도를 자국 영토라고 세뇌시켜 독도에 대한 침략 야욕을 계속하겠다는 신제국주의적 망상을 포기하지 않고 있습니다.
평화와 배려를 가르쳐야 할 교육이 거짓 선동과 철 지난 제국주의 망령을 주입하고 있습니다.
일본은 패전 76주년의 교훈을 잊어서는 안 됩니다. 세계는 서로 배려하고 존중할 때 평화를 만들 수 있습니다.
침략과 약탈의 만행은 반드시 역사의 심판을 받습니다. 일본은 지난 역사의 과오를 진심으로 반성하고 세계 평화의 장으로 나서 성숙한 인류애에 동참해야 합니다.
저는, 영토 수호에 있어서는 결코 물러섬 없이 강력하고 단호하게 대응해야 한다고 주장해왔습니다.
지금까지 우리 정부는 일본의 적대적 외교정책에도 불구하고 선린호혜의 정신으로 최선을 다해 대응해 왔습니다.
군국주의의 망령을 버리지 못하고 반성조차 없는 스가 일본 정부에 경고합니다.
더 이상 대한민국과 대한민국 국민의 인내심을 시험하지 마십시오. 
정의의 역사를 만들어 낸 우리 국민은 갈수록 노골화 되어가고 있는 일본의 침략 야욕을 결코 가만히 지켜보지 않을 것입니다. 
대한민국은 강합니다. 대한민국 국민은 더 강합니다.",314,41,61,2021-08-16 00:00:00,"['일본', '정부', '는', '독도', '침략', '야욕', '을', '포기', '하라', '일본', '정부', '가', '자국', '어린이', '와', '청소년', '을', '대상', '으로', '발간', '한', '방위', '백서', '에', '독도', '를', '자국', '영토', '로', '표기', '하고', '독도', '영', '유권', '을', '주장', '한', '사실', '이', '확인', '됐습니다', '일본', '정부', '는', '미래세', '대', '에', '독도', '를', '자국', '영토', '라고', '세뇌', '시켜', '독도', '에', '대한', '침략', '야욕', '을', '계속', '하겠다는', '신', '제국주의', '적', '망상', '을', '포기', '하지', '않고', '있습니다', '평화', '와', '배려', '를', '가르쳐야', '할', '교육', '이', '거짓', '선동', '과', '철', '지난', '제국주의', '망령', '을', '주입', '하고', '있습니다', '일본', '은', '패전', '76', '주년', '의', '교훈', '을', '잊어서는', '안', '됩니다', '세계', '는', '서로', '배려', '하고', '존중', '할', '때', '평화', '를', '만들', '수', '있습니다', '침략', '과', '약탈', '의', '만행', '은', '반드시', '역사', '의', '심판', '을', '받습니다', '일본', '은', '지난', '역사', '의', '과오', '를', '진심', '으로', '반성', '하고', '세계', '평화', '의', '장', '으로', '나서', '성숙한', '인류', '애', '에', '동참', '해야', '합니다', '저', '는', '영토', '수호', '에', '있어서는', '결코', '물러섬', '없이', '강력하고', '단호', '하게', '대응', '해야', '한다고', '주장', '해왔습니다', '지금', '까지', '우리', '정부', '는', '일본', '의', '적대', '적', '외교', '정책', '에도', '불구', '하고', '선린호혜', '의', '정신', '으로', '최선', '을', '다해', '대응', '해', '왔습니다', '군국', '주의', '의', '망령', '을', '버리지', '못', '하고', '반성', '조차', '없는', '스', '가', '일본', '정부', '에', '경고', '합니다', '더', '이상', '대한민국', '과', '대한민국', '국민', '의', '인내심', '을', '시험', '하지', '마십시오', '정의', '의', '역사', '를', '만들어', '낸', '우리', '국민', '은', '갈수록', '노골', '화', '되어가고', '있는', '일본', '의', '침략', '야욕', '을', '결코', '가만히', '지켜보지', '않을', '것', '입니다', '대한민국', '은', '강합니다', '대한민국', '국민', '은', '더', '강합니다']",-4.321630654739931,-1.27,,,,,,,,,,,,,,
"아이티에 규모 7.2의 강진이 발생했습니다. 2010년 대지진의 참사가 아물지 않은 상황에서 피해가 가중되지 않을까 걱정입니다.
이번 지진으로 가족과 생활의 터전을 잃고 비통함에 빠졌을 아이티 국민께 깊은 애도와 위로 말씀을 전합니다.
아이티는 지금 지진으로 약해진 지반에 열대성 저기압으로 인한 강풍과 폭우 예보로 추가 붕괴가 우려되는 상황입니다. 의료인력과 장비는 턱없이 부족합니다. 
국제사회의 연대와 도움이 절실히 필요합니다. 문재인 대통령께서도 아리엘 앙리 아이티 총리 앞으로 “긴급 구호를 위해 한국도 돕겠다”는 내용의 위로전을 보내셨습니다.
지진 피해의 조속한 수습과 북구 및 긴급구호가 이루어질 수 있기를 기원합니다.
사진출처-아이티 외교부",202,8,49,2021-08-16 00:00:00,"['아이티', '에', '규모', '72', '의', '강진', '이', '발생', '했습니다', '2010년', '대지진', '의', '참사', '가', '아물지', '않은', '상황', '에서', '피해', '가', '가중', '되지', '않을까', '걱정', '입니다', '이번', '지진', '으로', '가족', '과', '생활', '의', '터전', '을', '잃고', '비통함에', '빠졌을', '아이티', '국민', '께', '깊은', '애도', '와', '위로', '말씀', '을', '전', '합니다', '아이티', '는', '지금', '지진', '으로', '약해진', '지반', '에', '열', '대성', '저기압', '으로', '인한', '강풍', '과', '폭우', '예보', '로', '추가', '붕괴', '가', '우려', '되는', '상황', '입니다', '의료인', '력', '과', '장비', '는', '턱', '없이', '부족합니다', '국제사회', '의', '연대', '와', '도움', '이', '절실', '히', '필요합니다', '문재인', '대통령', '께', '서도', '아리엘', '앙리', '아이티', '총리', '앞', '으로', '긴급', '구호', '를', '위해', '한국', '도', '돕겠다는', '내용', '의', '위로', '전', '을', '보내셨습니다', '지진', '피해', '의', '조속', '한', '수습', '과', '북구', '및', '긴급', '구호', '가', '이루어질', '수', '있기를', '기원', '합니다', '사진', '출처', '아이티', '외교부']",-4.072102182466437,-1.3,,,,,,,True,,,,,,,
"[독도로 가는 하늘길이 열렸습니다.]
검푸른 동해 끝자락 외로운 섬 독도.
독도 상공은 군사훈련 지역이라 민간항공기의 비행이 불가했습니다.
그런데 광복 76주년을 맞이한 어제 처음으로 울릉도·독도 무착륙 비행이 허락되었습니다.
2025년 개항 예정인 울릉공항이 완성되면, 내륙에서 울릉도까지 1시간 이내에 왕래할 수 있다고 합니다.
76년 만에 한걸음 가까이 다가선 독도, 그 곳으로 가는 가슴시리도록 푸른 하늘길이 하루속히 열리길 바랍니다.
사진출처- 트위터",402,32,73,2021-08-16 00:00:00,"['독도', '로', '가는', '하늘', '길이', '열렸습니다', '검', '푸른', '동해', '끝', '자락', '외로운', '섬', '독도', '독도', '상공', '은', '군사훈련', '지역', '이라', '민간', '항공기', '의', '비행', '이', '불가했습니다', '그런데', '광복', '76', '주년', '을', '맞이', '한', '어제', '처음', '으로', '울릉도', '독도', '무', '착륙', '비행', '이', '허락', '되었습니다', '2025년', '개항', '예정', '인', '울릉공항', '이', '완성', '되면', '내륙', '에서', '울릉도', '까지', '1시간', '이내', '에', '왕래', '할', '수', '있다고', '합니다', '76년', '만에', '한', '걸음', '가까이', '다가선', '독도', '그', '곳', '으로', '가는', '가슴', '시리도록', '푸른', '하늘', '길이', '하루속히', '열리길', '바랍니다', '사진', '출처', '트위터']",-0.6432613094798614,-0.22,,,,,,,,,,,,,,
"[정치개혁·기본소득 본격논쟁 제안, 적극 환영합니다.]
오늘 우리당 21분 의원들께서 정치개혁과 기본소득에 대한 치열한 토론이 필요하다는 입장을 밝히셨습니다.
지금처럼 간단한 문답 수준으로 넘어가서는 제대로 된 경선이 될 수 없다는 의원 여러분의 문제의식에 전적으로 공감합니다.
저는 오래전부터 도덕성 검증은 당 차원의 클린검증단 설치로 해소하고, 1:1 맞짱토론으로 정책과 비전에 대한 심층검증을 하자고 제안해왔습니다.
이번 기회에 제대로 검증하고 제대로 토론해서 국민께 민주당의 미래 비전을 제시하고, 4기 민주정부 창출의 동력으로 만들어야 합니다.
의원들께서 제안하신 다양하고 풍부한 당내토론, 적극 공감합니다.",273,59,59,2021-08-16 00:00:00,"['정치', '개혁', '기본소득', '본격', '논쟁', '제안', '적극', '환영', '합니다', '오늘', '우리당', '21분', '의원', '들', '께서', '정치', '개혁', '과', '기본소득', '에', '대한', '치열한', '토론', '이', '필요하다는', '입장', '을', '밝히셨습니다', '지금', '처럼', '간단한', '문답', '수준', '으로', '넘어가서는', '제대로', '된', '경선', '이', '될', '수', '없다는', '의원', '여러분', '의', '문', '제', '의식', '에', '전적', '으로', '공감', '합니다', '저', '는', '오래전', '부터', '도덕성', '검증', '은', '당', '차원', '의', '클린', '검증', '단', '설치', '로', '해소', '하고', '11', '맞짱', '토론', '으로', '정책', '과', '비전에', '대한', '심층', '검증', '을', '하자', '고', '제안', '해왔습니다', '이번', '기회', '에', '제대로', '검증', '하고', '제대로', '토론', '해서', '국민', '께', '민주당', '의', '미래', '비전을', '제시', '하고', '4', '기', '민주', '정부', '창', '출의', '동력', '으로', '만들어야', '합니다', '의원', '들', '께서', '제안', '하신', '다양하고', '풍부한', '당내', '토론', '적극', '공감', '합니다']",1.9788705012194607,0.64,,,,,,,,,,,,,,
"코로나19 확산 이후, 낮 음주운전 사고가 늘어나고 있다는 기사를 읽었습니다. 거리두기 강화가 ‘낮술’로 이어지고 음주사고에 영향을 미치고 있다는 분석입니다. 
코로나 팬데믹 이후 우리 국민은 정부의 방역지침에 충실히 협조해왔습니다. 내가 조심해야 가족과 이웃이 안전하고 밤낮 없이 노력하는 의료진들의 노고를 잘 알기 때문입니다. 이처럼 K-방역은 국민 모두가 고통을 견디고 합심한 성과물입니다. 방역지침을 악용하고 음주운전 범죄까지 저지른 사람들에게 관용을 베풀어선 안 되는 이유입니다. 
저는 음주운전 처벌 강화를 위해 공직 기회 박탈 등 몇 가지 제안을 한 바 있습니다. 음주운전은 실수가 아닙니다. 고의적인 범죄입니다. 음주 운전에 대한 처벌 강화 반드시 필요합니다.",249,50,42,2021-08-16 00:00:00,"['코로나', '19', '확산', '이후', '낮', '음주운전', '사고', '가', '늘어나고', '있다는', '기사', '를', '읽었습니다', '거리', '두기', '강화', '가', '낮술', '로', '이어지고', '음주', '사고', '에', '영향', '을', '미치고', '있다는', '분석', '입니다', '코로나', '팬데믹', '이후', '우리', '국민', '은', '정부', '의', '방역', '지침', '에', '충실히', '협조', '해왔습니다', '내', '가', '조심해야', '가족', '과', '이웃', '이', '안전하고', '밤낮', '없이', '노력', '하는', '의료', '진', '들', '의', '노고', '를', '잘', '알기', '때문', '입니다', '이처럼', 'K', '방역', '은', '국민', '모두', '가', '고통', '을', '견디고', '합심', '한', '성과', '물', '입니다', '방역', '지침', '을', '악용', '하고', '음주운전', '범죄', '까지', '저지른', '사람', '들', '에게', '관용', '을', '베풀어선', '안', '되는', '이유', '입니다', '저', '는', '음주운전', '처벌', '강화', '를', '위해', '공직', '기회', '박탈', '등', '몇', '가지', '제안', '을', '한', '바', '있습니다', '음주운전', '은', '실수', '가', '아닙니다', '고', '의적', '인', '범죄', '입니다', '음주', '운전', '에', '대한', '처벌', '강화', '반드시', '필요합니다']",-5.428840872986575,-1.73,,,,,,,,,,,,,,
"[경기북도 설치, 균형발전의 시작입니다.]
경기북도 설치는 경기북부에 살고 계신 
350만 도민 여러분의 오랜 숙원입니다.
접경지역의 특수성, 각종 규제로 인해
경기남부에 비해 상대적으로 낙후된 북부지역을 
발전시켜야 한다는 지역주민의 열망이 커지고 있습니다.
그러나 오랜 시간이 흘렀음에도
경기 남-북부간 격차는 여전히 좁혀지지 않고 있습니다.
이미 경기 남부의 자원 일부를 북부에 투여한다고 
해결될 수준의 문제가 아닙니다.
경기북부에 맞는 새로운 비전과 전략이 필요합니다.
경기북도는 균열의 시작이 아니라
새로운 균형발전의 출발이 될 것입니다.
저, 정세균의 경기북부 발전을 위한 일곱 가지 약속입니다.
첫째, 경기북도를 설치하겠습니다.
국가균형발전, 행정서비스 질 향상, 한반도 평화시대의 
선제적 대비를 위해 반드시 필요한 과제입니다.
경기북도 설치에 대하여 조속한 주민투표를 실시,
주민의 손으로 만든 경기북부 시대를 열겠습니다.
둘째, 새롭게 만들어질 경기북도에 
고등법원과 가정법원을 설치하겠습니다.
경기북부 주민에게 양질의 사법서비스 제공하겠습니다.
셋째, 경기북부 거점공공의료원을 설립하겠습니다.
경기북부의 규모나 위상에 맞는 거점공공의료원을 설립,
경기북부 의료 사각지대를 해소하겠습니다.
넷째, 접경지역 평화경제특구를 설치하겠습니다.
접경지역 평화벨트의 핵심축이자
한반도 물류 메카로 만들겠습니다.
다섯째, 주한미군 공여지 조기 반환을 추진하겠습니다.
경기도 22곳 중 17곳이 반환되었고,
나머지 5곳도 조속한 반환을 마무리하겠습니다.
반환 공여지의 환경오염 문제도 함께 해결하겠습니다.
여섯째, 8호선 별내선 의정부 연장선을 조기 착공하겠습니다.
제4차 국가철도망계획에 포함된 사업으로
수도권 순환철도망 완성의 마지막 구간입니다.
조속한 추진으로 경기북부 주민의 
교통기본권을 실현하겠습니다.
일곱째, 경기북부 모빌리티 클러스터 
조성사업을 지원하겠습니다.
서울-문산 고속도로를 활용하여
물류 자율주행 시험운행 등을 실시하겠습니다.
김대중이 열고 노무현이 진전시키고 
문재인이 정착시킨 국가균형발전의 길,
정세균의 경기북부 플랜으로 완성하겠습니다.
균형발전 4.0 시대, 
경기북도에서 시작하겠습니다.",123,26,5,2021-08-16 00:00:00,"['경기', '북도', '설치', '균형발전', '의', '시작', '입니다', '경기', '북도', '설치는', '경', '기', '북부', '에', '살', '고', '계신', '350만', '도민', '여러분', '의', '오랜', '숙원', '입니다', '접경', '지역', '의', '특수성', '각종', '규제', '로', '인해', '경', '기', '남부', '에', '비해', '상대', '적', '으로', '낙후', '된', '북부', '지역', '을', '발전', '시켜야', '한다는', '지역', '주민', '의', '열망', '이', '커지고', '있습니다', '그러나', '오랜', '시간', '이', '흘렀음에도', '경기', '남북', '부간', '격차', '는', '여전히', '좁혀지지', '않고', '있습니다', '이미', '경기', '남부', '의', '자원', '일부', '를', '북부', '에', '투여', '한다고', '해결', '될', '수준', '의', '문제', '가', '아닙니다', '경', '기', '북부', '에', '맞는', '새로운', '비', '전과', '전략', '이', '필요합니다', '경', '기', '북도', '는', '균열', '의', '시작', '이', '아니라', '새로운', '균형발전', '의', '출발', '이', '될', '것', '입니다', '저', '정세균', '의', '경기', '북부', '발전', '을', '위', '한', '일곱', '가지', '약속', '입니다', '첫째', '경', '기', '북도', '를', '설치', '하겠습니다', '국가', '균형발전', '행정', '서비스', '질', '향상', '한반도', '평화', '시', '대의', '선제', '적', '대비', '를', '위해', '반드시', '필요한', '과제', '입니다', '경기', '북도', '설치', '에', '대하', '여', '조속', '한', '주민', '투표', '를', '실시', '주민', '의', '손', '으로', '만든', '경기', '북부', '시대', '를', '열겠습니다', '둘째', '새롭게', '만들어질', '경', '기', '북도', '에', '고등법원', '과', '가정법원', '을', '설치', '하겠습니다', '경기', '북부', '주민', '에게', '양질', '의', '사법', '서비스', '제공', '하겠습니다', '셋째', '경기', '북부', '거점', '공공', '의료', '원', '을', '설립', '하겠습니다', '경', '기', '북부', '의', '규모', '나', '위상', '에', '맞는', '거점', '공공', '의료', '원', '을', '설립', '경기', '북부', '의료', '사', '각', '지대', '를', '해소', '하겠습니다', '넷째', '접경', '지역', '평화', '경제특구', '를', '설치', '하겠습니다', '접경', '지역', '평화', '벨트', '의', '핵심', '축', '이자', '한반도', '물류', '메카', '로', '만들겠습니다', '다섯째', '주', '한', '미군', '공', '여지', '조기', '반환', '을', '추진', '하겠습니다', '경기도', '22', '곳', '중', '17', '곳', '이', '반환', '되었고', '나머지', '5', '곳도', '조속', '한', '반환', '을', '마무리', '하겠습니다', '반환', '공', '여지', '의', '환경오염', '문제', '도', '함께', '해결', '하겠습니다', '여섯째', '8', '호선', '별내선', '의정부', '연', '장선', '을', '조기', '착공', '하겠습니다', '제', '4', '차', '국가', '철', '도망', '계획', '에', '포함', '된', '사업', '으로', '수도권', '순', '환철', '도망', '완성', '의', '마지막', '구간', '입니다', '조속', '한', '추진', '으로', '경기', '북부', '주민', '의', '교통', '기본권', '을', '실현', '하겠습니다', '일곱째', '경기', '북부', '모빌리티', '클러스터', '조', '성', '사업', '을', '지원', '하겠습니다', '서울', '문산', '고속도로', '를', '활용', '하여', '물류', '자율', '주행', '시험', '운행', '등', '을', '실시', '하겠습니다', '김대중', '이', '열고', '노무현', '이', '진전', '시키고', '문재인', '이', '정착', '시킨', '국가', '균형발전', '의', '길', '정세균', '의', '경기', '북부', '플랜', '으로', '완성', '하겠습니다', '균형발전', '40', '시대', '경', '기', '북도', '에서', '시작', '하겠습니다']",7.031856032693502,1.95,,,,,,,True,,,,,,,
