sentence,like_count,comment_count,share_count,date,comment,score,ratio,백신,부동산,북한,재난지원금,국민지원금,청년,문재인,윤석열,이준석,이재명,복지,접종,노조,기업
"[4대 벤처강국의 꿈, ‘사람중심 혁신성장’으로 이어가겠습니다.]
문재인 대통령께서 어제 “제2벤처붐 토대로 글로벌 ‘4대 벤처강국’으로 도약하겠다”는 의지를 표명했습니다.
이를 위해 기술창업을 2024년까지 30만 개로 늘리고, 우수인재 유치를 위한 자금 유입 촉진, 벤처창업 지원 위한 1조원 전용펀드 신규조성 등 벤처산업에 대한 정부의 지원도 약속했습니다.
정세균이 발표한 공약과도 맞닿아 있는 정책입니다. 저는 중소벤처기업 활성화를 위해 창업재기지원펀드를 기존 3000억원에서 1조원으로 확대해 기업인들의 재도전을 돕겠다고 말씀드렸습니다.
아울러 반도체, 이차전지, 바이오, 수소, 혁신 DNA(데이터, 네트워크, AI), 항공우주산업 등 국가핵심전략 산업을 집중 육성하고, 기업가 정신 제고를 위해 네거티브 규제시스템으로의 전환과 신산업에 대한 사후 규제 도입, 시대에 뒤떨어진 갈라파고스 규제 폐지 등도 약속 드렸습니다. 
우리에겐 위기 극복의 DNA가 있습니다. IMF 외환위기를 IT강국의 디딤돌로 삼은 것처럼, 코로나 위기를 혁신경제로 나아가는 기회로 삼아야 합니다.
경제 전문가 정세균이 ‘사람중심 혁신성장’으로 문재인 정부의 정책을 계승하고 제2벤처붐 지원하겠습니다. 4대 벤처강국으로의 확실한 도약 이끌겠습니다.",60,6,3,2021-08-27 00:00:00,"['4', '대', '벤', '처', '강국', '의', '꿈', '사람', '중심', '혁신', '성장', '으로', '이어가겠습니다', '문재인', '대통령', '께서', '어제', '제', '2', '벤', '처붐', '토대', '로', '글로벌', '4', '대', '벤', '처', '강국', '으로', '도약', '하겠다는', '의지', '를', '표명', '했습니다', '이를', '위해', '기술', '창업', '을', '2024년', '까지', '30만', '개', '로', '늘리고', '우수', '인재', '유치', '를', '위', '한', '자금', '유입', '촉진', '벤', '처', '창업', '지원', '위', '한', '1조원', '전용', '펀드', '신규', '조성', '등', '벤', '처', '산업', '에', '대한', '정부', '의', '지원', '도', '약속', '했습니다', '정세균', '이', '발표', '한', '공약', '과도', '맞닿아', '있는', '정책', '입니다', '저', '는', '중소', '벤처기업', '활성화', '를', '위해', '창업', '재기', '지원', '펀드', '를', '기존', '3000억원', '에서', '1조원', '으로', '확대', '해', '기업인', '들', '의', '재도전을', '돕겠다고', '말씀드렸습니다', '아울러', '반도체', '이차전지', '바이오', '수소', '혁신', 'DNA', '데이터', '네트워크', 'AI', '항공우주', '산업', '등', '국가', '핵심', '전략', '산업', '을', '집중', '육성', '하고', '기업가', '정신', '제', '고', '를', '위해', '네거티브', '규제', '시스템', '으로의', '전환', '과', '신', '산업', '에', '대한', '사후', '규제', '도입', '시대', '에', '뒤', '떨어진', '갈라파고스', '규제', '폐지', '등', '도', '약속', '드렸습니다', '우리', '에겐', '위기', '극복', '의', 'DNA', '가', '있습니다', 'IMF', '외환위기', '를', 'IT', '강국', '의', '디딤돌', '로', '삼은', '것', '처럼', '코로나', '위기', '를', '혁신', '경제', '로', '나아가는', '기회', '로', '삼', '아야', '합니다', '경제', '전문가', '정세균', '이', '사람', '중심', '혁신', '성장', '으로', '문재인', '정부', '의', '정책', '을', '계승', '하고', '제', '2', '벤', '처붐', '지원', '하겠습니다', '4', '대', '벤', '처', '강국', '으로의', '확실한', '도약', '이끌겠습니다']",1.4639489087667816,0.44,,,,,,,True,,,,,,,True
"[장인어른, 사위 세균이가 왔습니다]
오늘 국립대전현충원 홍범도 장군님 묘역 참배 후, 묘역 한 곳을 더 찾았습니다.
독립유공자 제2묘역 460호 애국지사 최홍준(崔弘俊)의 묘, 제 장인의 묘역입니다.
장인 故 최홍준 옹은 경북 영일에서 출생해 일제강점기 때 효민회(曉民會)를 조직하여 '민족문화 향상과 경제력 제고를 통한 독립'을 고취하는 등 항일운동을 펼치다 일경에 체포돼 옥고를 치른 독립운동가입니다. 
장인은 조국 독립과 그 정신을 지키며 평생을 살았습니다. 이후 독립운동의 공로를 인정받아  1963년 대통령 표창과 1977년 건국포장, 1990년에는 건국훈장 애국장을 수여 받았습니다.  
지금으로부터 40여 년 전, 군 복무를 마치고 아내와 교제 허락을 받기 위해 장인어른을 처음 찾아뵈었습니다. 바짝 긴장한 제 손을 잡으시고 인자한 웃음으로 교제를 허락해주셨지요. 
함박웃음 짓던 당신의 웃음이 마치 어제만 같습니다. 당신은 제겐 큰 산 이었습니다. 세상의 어려움을 만날 때마다 당신을 떠올립니다. 돈과 명예가 보장된 대기업 임원을 내려놓고 모두 반대하던 야당정치인이 되겠다고 했을 때도 당신께서는 누구보다 저를 믿고 응원해주셨습니다. 
“장인어른이 정말 사무치게 그립습니다.” 
하늘에서 보시기에 제가 잘 하고 있는지 송구한 마음뿐입니다. 참배를 하며 장인께 약속을 드렸습니다. 
‘사위 세균’이 국민이 행복한 나라, 국민이 강한 대한민국을 만드는 일에 모든 것을 걸겠습니다. 당신께서 꿈꾸셨던 ‘고난의 역사가 되풀이 되지 않는 나라’, ‘세계가 우러러 보는 강한 나라’ 그런 대한민국을 꼭 만들겠습니다. 
부디, 하늘에서 지켜봐주십시오.",992,115,95,2021-08-27 00:00:00,"['장인어른', '사위', '세균', '이', '가', '왔습니다', '오늘', '국립대전현충원', '홍범도', '장군', '님', '묘역', '참배', '후', '묘역', '한', '곳', '을', '더', '찾았습니다', '독립유공자', '제', '2', '묘역', '460', '호', '애국지사', '최홍', '준', '의', '묘', '제', '장인', '의', '묘역', '입니다', '장인', '최홍', '준', '옹', '은', '경북', '영일', '에서', '출생', '해', '일제강점기', '때', '효', '민회', '를', '조직', '하여', '민족', '문화', '향상', '과', '경제력', '제', '고', '를', '통한', '독립', '을', '고취', '하는', '등', '항일', '운동', '을', '펼치다', '일경', '에', '체포', '돼', '옥', '고를', '치른', '독립운동가', '입니다', '장인', '은', '조국', '독립', '과', '그', '정신', '을', '지키며', '평생', '을', '살았습니다', '이후', '독립운동', '의', '공로', '를', '인정받아', '1963년', '대통령', '표창', '과', '1977년', '건국', '포장', '1990년', '에는', '건국', '훈장', '애국', '장', '을', '수여', '받았습니다', '지금', '으로부터', '40', '여', '년', '전', '군', '복무', '를', '마치', '고', '아내', '와', '교제', '허락', '을', '받기', '위해', '장인어른', '을', '처음', '찾아', '뵈었습니다', '바짝', '긴장', '한', '제', '손', '을', '잡으시고', '인자한', '웃음', '으로', '교제', '를', '허락', '해주셨지요', '함박', '웃음', '짓던', '당신', '의', '웃음', '이', '마치', '어제', '만', '같습니다', '당신', '은', '제겐', '큰', '산', '이었습니다', '세상', '의', '어려움', '을', '만날', '때', '마다', '당신', '을', '떠올립니다', '돈', '과', '명예', '가', '보장', '된', '대기업', '임원', '을', '내려놓고', '모두', '반대', '하던', '야당', '정치인', '이', '되겠다고', '했을', '때', '도', '당신', '께서는', '누구', '보다', '저', '를', '믿고', '응원', '해주셨습니다', '장인어른', '이', '정말', '사무치게', '그립습니다', '하늘', '에서', '보시기에', '제', '가', '잘', '하고', '있는지', '송구', '한', '마음', '뿐입니다', '참배', '를', '하며', '장인', '께', '약속', '을', '드렸습니다', '사위', '세균', '이', '국민', '이', '행복한', '나라', '국민', '이', '강한', '대한민국', '을', '만드는', '일', '에', '모든', '것', '을', '걸겠습니다', '당신', '께서', '꿈꾸셨던', '고난', '의', '역사', '가', '되풀이', '되지', '않는', '나라', '세계', '가', '우러러', '보는', '강한', '나라', '그런', '대한민국', '을', '꼭', '만들겠습니다', '부디', '하늘', '에서', '지켜봐주십시오']",1.3918467263003462,0.4,,,,,,,,,,,,,,True
"[역사를 잊은 민족에게 미래는 없다]
머나먼 이국 땅, 카자흐스탄 크즐오르다에 잠들어 계시다 78년 만에 고국으로 돌아오신 홍범도 장군님 묘역에 참배했습니다.
2017년, 국회의장으로 재직하던 시절부터 시작한 유해 송환 노력이 성과를 거둔 것 같아 감회가 새롭습니다. 참배를 하는 내내 너무 늦게 장군을 모신 것이 죄송스러웠습니다. 
“역사를 잊은 민족에게 미래는 없다.”는 말이 있습니다. 지금 우린 이 금언 앞에 당당할 수 있는지 돌아봐야 합니다. 
광복 76년이 지났습니다. 친일파가 독립투사로 변신하고, 친일 잔존세력들이 우리사회 특권을 누리며 호령하고 있습니다. “친일을 하면 3대가 흥하고 독립운동을 하면 3대가 망한다.”는 비아냥거림이 아직 우리 사회에서 현실로 구현되고 있습니다.
올해 93세, 오희옥 여사님은 생존해 계신 유일한 여성 독립운동가입니다. 13세 어린 나이, 한국광복진선청년공작대원 선전 활동을 시작으로, 15세에 광복군 5지대에서 광복군으로 활약했습니다. 해방이 되기까지 한국독립당 당원으로 활동하면서 대한독립에 당신의 모든 것을 쏟아 부었습니다. 
“여생을 고향 용인에서 보내고 싶다.”는 오여사님의 말씀을 받들어 지자체와 뜻있는 용인시민의 십시일반 후원으로 사택을 지었지만 얼마 생활하지도 못하고 급성 뇌경색으로 쓰러져 병원에서 투병 중에 있습니다.
현재, 사택 부지를 포함한 인근 지역이 대기업 사업부지로 선정되면서 철거 위기에 놓여 있습니다. 조국의 독립을 위해 헌신하신 분들을 제대로 모시지 못하는 죄송스럽고 부끄러운 현실이 안타깝습니다. 
정부와 보훈처가 대안을 마련해야 합니다. 조국을 위해 헌신하고 희생한 분들을 끝까지 기억하고 모시는 것은 정부가 당연히 해야할 책무입니다.
나라를 위한 희생이 존경 받고, 나라를 팔아먹은 매국이 벌을 받는다는 정직한 정의를 역사에 새겨야 합니다. 
우리는 후손에게 정의로운 역사를 물려주어야 할 의무가 있습니다.
순국선열과 호국 영령들께서 자랑스러워하실 나라. 후손이 순국선열과 호국 영령들을 기억하고 기리는 나라. 역사를 바로 세우고, 정의를 바로 세우는, 정의가 강한 대한민국 정세균이 반드시 구현하겠습니다.",395,54,67,2021-08-27 00:00:00,"['역사', '를', '잊은', '민족', '에게', '미래', '는', '없다', '머나먼', '이국', '땅', '카자흐스탄', '크', '즐', '오르다', '에', '잠들어', '계시', '다', '78년', '만에', '고국', '으로', '돌아오신', '홍범도', '장군', '님', '묘역', '에', '참배', '했습니다', '2017년', '국회의장', '으로', '재직', '하던', '시절', '부터', '시작', '한', '유해', '송환', '노력', '이', '성과', '를', '거둔', '것', '같아', '감회', '가', '새롭습니다', '참배', '를', '하는', '내내', '너무', '늦게', '장군', '을', '모신', '것', '이', '죄송스러웠습니다', '역사', '를', '잊은', '민족', '에게', '미래', '는', '없다는', '말', '이', '있습니다', '지금', '우린', '이', '금언', '앞', '에', '당당할', '수', '있는지', '돌아봐야', '합니다', '광복', '76년', '이', '지났습니다', '친일파', '가', '독립', '투사', '로', '변신', '하고', '친일', '잔존', '세력', '들', '이', '우리', '사회', '특권', '을', '누리', '며', '호령', '하고', '있습니다', '친일', '을', '하면', '3', '대가', '흥', '하고', '독립운동', '을', '하면', '3', '대가', '망한다는', '비아', '냥', '거림', '이', '아직', '우리', '사회', '에서', '현실', '로', '구현', '되고', '있습니다', '올해', '93', '세', '오희', '옥', '여사', '님', '은', '생존', '해', '계신', '유일한', '여성', '독립운동가', '입니다', '13', '세', '어린', '나이', '한국', '광복', '진선', '청년', '공', '작', '대원', '선전', '활동', '을', '시작', '으로', '15', '세', '에', '광복군', '5', '지대', '에서', '광복군', '으로', '활약', '했습니다', '해방', '이', '되기까지', '한국', '독립', '당', '당원', '으로', '활동', '하면서', '대', '한', '독립', '에', '당신', '의', '모든', '것', '을', '쏟아', '부었습니다', '여생', '을', '고향', '용인', '에서', '보내고', '싶다는', '오', '여사', '님', '의', '말씀', '을', '받', '들어', '지자체', '와', '뜻', '있는', '용인', '시민', '의', '십', '시', '일반', '후원', '으로', '사택', '을', '지었지만', '얼마', '생활', '하지도', '못', '하고', '급성', '뇌경색', '으로', '쓰러져', '병원', '에서', '투병', '중', '에', '있습니다', '현재', '사택', '부지', '를', '포함', '한', '인근', '지역', '이', '대기업', '사업', '부지', '로', '선정', '되면서', '철거', '위기', '에', '놓여', '있습니다', '조국', '의', '독립', '을', '위해', '헌신', '하신', '분', '들', '을', '제대로', '모시', '지', '못', '하는', '죄송스럽고', '부끄러운', '현실', '이', '안타깝습니다', '정부', '와', '보훈처', '가', '대안', '을', '마련', '해야', '합니다', '조국', '을', '위해', '헌신', '하고', '희생', '한', '분', '들', '을', '끝', '까지', '기억', '하고', '모시는', '것', '은', '정부', '가', '당연히', '해야', '할', '책무', '입니다', '나라', '를', '위', '한', '희생', '이', '존경', '받고', '나라', '를', '팔', '아', '먹은', '매국', '이', '벌', '을', '받는다는', '정직한', '정의', '를', '역사', '에', '새겨야', '합니다', '우리', '는', '후손', '에게', '정의', '로운', '역사', '를', '물려주어야', '할', '의무', '가', '있습니다', '순국선열', '과', '호국', '영령', '들', '께서', '자랑스러워하실', '나라', '후손', '이', '순국선열', '과', '호국', '영령', '들', '을', '기억', '하고', '기리', '는', '나라', '역사', '를', '바로', '세우고', '정의', '를', '바로', '세우는', '정의', '가', '강한', '대한민국', '정세균', '이', '반드시', '구현', '하겠습니다']",-6.715363491946297,-1.87,,,,,,True,,,,,,,,True
"[부동산 양극화와 세대 간 대물림의 고리, 정세균이 끊겠습니다.]
민간연구기관 LAB2050이 발표한 보고서에 따르면 최근 몇 년간 상위 2%와 하위 30% 가구의 부동산자산 격차가 급격하게 더 벌어졌습니다.
이와 함께 일부 상위계층의 부동산 독식 현상이 세대로 대물림되는 현상도 또렷이 나타났습니다. 모든 연령대 중 부동산 양극화가 가장 극심한 연령대는 20대였습니다.
지난해 기준 전체 20대가 보유한 부동산 자산의 41.7%를 상위 2%가 소유 중인 것으로 분석되었으며, 하위 30%의 부동산 자산은 0에 수렴됐습니다.
대다수 청년이 느낄 박탈감과 절망감을 생각하니 참으로 송구스럽고 마음이 아픕니다. 
일부 상위계층의 부동산 독식, 그로 인한 자산 불평등과 세대 간 대물림이 공정한 일입니까?
저는 청년들에게 ‘부모 찬스’ 대신 ‘국가 찬스’를 제공하겠다고 약속했습니다.
미래씨앗통장을 통해 부모찬스 없이도 사회초년생이 됐을 때 자립기반을 구축할 수 있도록 국가가 나서겠습니다. 주택 공급폭탄을 통해 2017년 수준으로 주택가격 안정을 이루겠습니다.
부동산으로 신분이 정해지고 자녀에게 세습되는 新계급사회의 고리를 끊겠습니다.
청년세대에게 절망이 아닌 기회를 제공하고, 불평등이 아닌 공정시대를 경제전문가 정세균이 열겠습니다.",227,26,54,2021-08-26 00:00:00,"['부동산', '양극화', '와', '세대', '간', '대물림의', '고리', '정세균', '이', '끊겠습니다', '민간', '연구기관', 'LAB', '2050', '이', '발표', '한', '보고서', '에', '따르면', '최근', '몇', '년', '간', '상위', '2', '와', '하위', '30', '가구', '의', '부동산', '자산', '격차', '가', '급격하게', '더', '벌어졌습니다', '이', '와', '함께', '일부', '상위', '계층', '의', '부동산', '독식', '현상', '이', '세대', '로', '대물림', '되는', '현상', '도', '또렷', '이', '나타났습니다', '모든', '연령', '대', '중', '부동산', '양극화', '가', '가장', '극심한', '연령', '대', '는', '20', '대였습니다', '지난해', '기준', '전체', '20', '대가', '보유', '한', '부동산', '자산', '의', '417', '를', '상위', '2', '가', '소유', '중인', '것', '으로', '분석', '되었으며', '하위', '30', '의', '부동산', '자산', '은', '0', '에', '수렴', '됐습니다', '대다수', '청년', '이', '느낄', '박탈', '감', '과', '절망', '감', '을', '생각', '하니', '참으로', '송구', '스럽고', '마음', '이', '아픕니다', '일부', '상위', '계층', '의', '부동산', '독식', '그로', '인한', '자산', '불평등', '과', '세대', '간', '대물림이', '공정한', '일', '입', '니까', '저', '는', '청년', '들', '에게', '부모', '찬스', '대신', '국가', '찬스', '를', '제공', '하겠다고', '약속', '했습니다', '미래', '씨앗', '통장', '을', '통해', '부모', '찬스', '없이도', '사회', '초년', '생', '이', '됐을', '때', '자립', '기반', '을', '구축', '할', '수', '있도록', '국가', '가', '나서겠습니다', '주택', '공급', '폭탄', '을', '통해', '2017년', '수준', '으로', '주택', '가격', '안정', '을', '이루겠습니다', '부동산', '으로', '신분', '이', '정해지고', '자녀', '에게', '세습', '되는', '계급', '사회', '의', '고리', '를', '끊겠습니다', '청년', '세대', '에게', '절망', '이', '아닌', '기회', '를', '제공', '하고', '불평등', '이', '아닌', '공', '정시', '대', '를', '경제', '전문가', '정세균', '이', '열겠습니다']",3.2495284722734947,0.97,,True,,,,True,,,,,,,,
"[역사를 바로 세우는 일, 후손의 책무입니다]
대전 국립현충원 현판이 ‘안중근체’로 교체되었습니다.
지금까지 대전 국립현충원의 현판은 전두환 씨가 쓴 현판이었습니다. 늦었지만 무척 기쁘고 반가운 일입니다.
나라를 위해 희생하고 헌신한 선열의 넋이 묻힌 곳, 충의와 위훈을 기리기 위한 장소에 민주주의를 짓밟고 국민을 살해한 장본인이 쓴 친필 현판이 걸려있다는 것은 대한민국 역사의 오점입니다.  
새롭게 설치된 ‘안중근체’의 현판은 안중근 의사께서 하얼빈 의거를 앞두고 자필로 쓰신 시 ‘장부가’의 한글 원본을 토대로 만들어진 글씨체입니다.
현판 하나에도 올바른 정신을 담아야 합니다. 올바른 역사를 기리는 일은 올바른 미래를 만드는 일입니다. 
이번 현판 교체로 잘못된 역사는 바로잡아 세우고 순국선열의 숭고한 헌신과 희생의 가치는  영원히 계승되어야 합니다. 
정세균, 바른 역사를 세우겠습니다. 꼭 그리하겠습니다.
사진출처-연합뉴스",487,40,106,2021-08-26 00:00:00,"['역사', '를', '바로', '세우는', '일', '후손', '의', '책무', '입니다', '대전', '국립현충원', '현판', '이', '안중근', '체', '로', '교체', '되었습니다', '지금', '까지', '대전', '국립현충원', '의', '현판', '은', '전두환', '씨', '가', '쓴', '현판', '이었습니다', '늦었지만', '무척', '기쁘고', '반가운', '일', '입니다', '나라', '를', '위해', '희생', '하고', '헌신', '한', '선열', '의', '넋', '이', '묻힌', '곳', '충의', '와', '위훈', '을', '기', '리기', '위', '한', '장소', '에', '민주주의', '를', '짓', '밟고', '국민', '을', '살해', '한', '장본인', '이', '쓴', '친필', '현판', '이', '걸려있다는', '것', '은', '대한민국', '역사', '의', '오점', '입니다', '새롭게', '설치', '된', '안중근', '체', '의', '현판', '은', '안중근', '의사', '께서', '하얼빈', '의거', '를', '앞두고', '자필', '로', '쓰신', '시', '장부', '가의', '한글', '원본', '을', '토대', '로', '만들어진', '글씨체', '입니다', '현판', '하나', '에도', '올바른', '정신', '을', '담아야', '합니다', '올바른', '역사', '를', '기리', '는', '일', '은', '올바른', '미래', '를', '만드는', '일', '입니다', '이번', '현판', '교체', '로', '잘', '못', '된', '역사', '는', '바로잡아', '세우고', '순국선열', '의', '숭고한', '헌신', '과', '희생', '의', '가치', '는', '영원히', '계승', '되어야', '합니다', '정세균', '바른', '역사', '를', '세우겠습니다', '꼭', '그리하겠습니다', '사진', '출처', '연합뉴스']",8.14231825402685,2.53,,,,,,,,,,,,,,
